14737553000136; BRASIL PORTOS E ATIVOS LOGÍSTICOS - FIP;0;BRASIL PORTOS E ATIVOS LOGÍSTICOS - FUNDO DE INVESTIMENTO EM PARTICIPAÇÕES MULTIESTRATÉGIA;30822936;02888152;Artigo 8º, Inciso IV, 'a';ART8IVA; 1;FIP;BRASIL PORTOS E ATIVOS LOGÍSTICOS - FUNDO DE INVESTIMENTO EM PARTICIPAÇÕES MULTIESTRATÉGIA;2011-12-23;2012-01-16;NA;EM FUNCIONAMENTO NORMAL;2012-03-29;2020-04-01;2021-03-31;   7;0;NA;NA;NA
14964240000110; BB Prev Ima Geral Ex C;0;BB PREVIDENCIÁRIO RENDA FIXA IMA GERAL EX-C TÍTULOS PÚBLICOS FUNDO DE INVESTIMENTO;30822936;30822936;Artigo 7º, Inciso I, 'b';ART7IB; 1;NA;NA;NA;NA;NA;NA;NA;NA;NA; 165;0;2020-05-29;  572696186;   134
15153656000111; MONTE CARLO INSTITUCIONAL IMA-B 5 FI RENDA FIXA;1;FUNDO DE INVESTIMENTO RENDA FIXA MONTE CARLO INSTITUCIONAL IMA-B 5;42066258;12678380;Artigo 7º, Inciso IV, 'a';ART7IVA; 0;NA;NA;NA;NA;NA;NA;NA;NA;NA;  12;1;NA;NA;NA
15154220000147; CAIXA SMALL CAPS ATIVO FI AÇÕES;0;FUNDO DE INVESTIMENTO EM AÇÕES CAIXA SMALL CAPS ATIVO;00360305;00360305;Artigo 8º, Inciso II, 'a';ART8IIA; 1;NA;NA;NA;NA;NA;NA;NA;NA;NA; 146;0;2020-05-29;  950738261; 15975
15154236000150; CAIXA FI AÇÕES BRASIL ETF IBOVESPA;0;FUNDO DE INVESTIMENTO EM AÇÕES CAIXA BRASIL ETF IBOVESPA;00360305;00360305;Artigo 8º, Inciso I, 'a';ART8IA; 1;NA;NA;NA;NA;NA;NA;NA;NA;NA;  39;0;2020-05-29;  107680207;    62
15154441000115; FIC Ações Valôr Dovidendos;0;FUNDO DE INVESTIMENTO EM COTAS DE FUNDOS DE INVESTIMENTO EM AÇÕES CAIXA VALOR DIVIDENDOS RPPS;00360305;10917835;Artigo 8º, Inciso II, 'a';ART8IIA; 1;NA;NA;NA;NA;NA;NA;NA;NA;NA; 159;0;2020-05-29;  768284939;   154
15182416000145; TOTAL MIX FIC FIA;0;TOTAL MIX FI EM COTAS DE FUNDOS DE INVESTIMENTO DE AÇÕES;11010779;12564465;Artigo 8º, Inciso II, 'a';ART8IIA; 0;NA;NA;NA;NA;NA;NA;NA;NA;NA;   2;0;NA;NA;NA
15188380000107; INFINITY TIGER ALOCAÇÃO DINAMICA FI RENDA FIXA;0;INFINITY TIGER ALOCAÇÃO DINÂMICA FUNDO DE INVESTIMENTO RENDA FIXA;00806535;03403181;Artigo 7º, Inciso IV, 'a';ART7IVA; 0;NA;NA;NA;NA;NA;NA;NA;NA;NA;  22;0;2020-05-29;   64400351;    30
15190417000131; ÁTICO FLORESTAL FICFIP;1;BRASIL FUNDO DE INVESTIMENTO EM COTAS DE FUNDOS DE INVESTIMENTO EM PARTICIPAÇÕES - ÁTICO FLORESTAL;02201501;07250864;Artigo 8º, Inciso IV, 'a';ART8IVA; 0;FIP;BRASIL FLORESTAL FUNDO DE INVESTIMENTO EM COTAS DE FUNDOS DE INVESTIMENTO EM PARTICIPAÇÕES;2012-05-03;2012-05-29;NA;EM FUNCIONAMENTO NORMAL;2012-07-04;2019-07-01;2020-06-30;  17;0;NA;NA;NA
15259071000180; BRADESCO H FUNDO DE INVESTIMENTO RENDA FIXA NILO;0;BRADESCO H FUNDO DE INVESTIMENTO RENDA FIXA NILO;60746948;62375134;Artigo 7º, Inciso IV, 'a';ART7IVA; 1;NA;NA;NA;NA;NA;NA;NA;NA;NA;  13;0;2020-05-29;  784739834;    23
15350909000147; VITORIA REGIA FIRF LP;1;VITÓRIA RÉGIA FUNDO DE INVESTIMENTO DE RENDA FIXA LONGO PRAZO;02201501;22119959;Artigo 7º, Inciso IV, 'a';ART7IVA; 0;NA;NA;NA;NA;NA;NA;NA;NA;NA;   4;1;2020-05-29;   30950941;     5
15461076000191; BR HOTÉIS FII;1;FUNDO DE INVESTIMENTO IMOBILIÁRIO BR HOTÉIS;28048783;11010779;Artigo 8º, Inciso IV, 'b';ART8IVB; 0;F.I.I.;FUNDO DE INVESTIMENTO IMOBILIÁRIO BR HOTÉIS;2012-12-18;2012-04-19;NA;EM FUNCIONAMENTO NORMAL;2012-12-18;2020-01-01;2020-12-31;  10;1;NA;NA;NA
15477710000184; BB DIVIDENDOS FIC AÇÕES PREVIDENCIÁRIO;0;BB PREVIDENCIÁRIO AÇÕES DIVIDENDOS FUNDO DE INVESTIMENTO EM COTAS DE FUNDOS DE INVESTIMENTO;30822936;30822936;Artigo 8º, Inciso II, 'a';ART8IIA; 1;NA;NA;NA;NA;NA;NA;NA;NA;NA;   9;0;NA;NA;NA
15486093000183; BB PREVIDENCIARIO RENDA FIXA TITULOS PUBLICOS IPCA;0;BB PREVIDENCIÁRIO RENDA FIXA TÍTULOS PÚBLICOS IPCA FUNDO DE INVESTIMENTO;30822936;30822936;Artigo 7º, Inciso I, 'b';ART7IB; 1;NA;NA;NA;NA;NA;NA;NA;NA;NA;  53;0;2020-05-29;  341154567;    51
15538445000105; SP DOWNTOWN FI IMOBILIARIO;0;SP DOWNTOWN FUNDO DE INVESTIMENTO IMOBILIÁRIO - FII;27652684;22119959;Artigo 8º, Inciso IV, 'b';ART8IVB; 0;F.I.I.;SP DOWNTOWN FUNDO DE INVESTIMENTO IMOBILIÁRIO - FII;2013-04-16;2012-04-30;NA;EM FUNCIONAMENTO NORMAL;2013-04-16;2020-01-01;2020-12-31;   1;0;NA;NA;NA
15569128000148; Equitas Selection Institucional FIC Fia;0;EQUITAS SELECTION INSTITUCIONAL FUNDO DE INVESTIMENTO EM COTAS DE FUNDOS DE INVESTIMENTO DE AÇÕES;02201501;08204817;Artigo 8º, Inciso II, 'a';ART8IIA; 0;NA;NA;NA;NA;NA;NA;NA;NA;NA;   6;0;2020-05-29;  464269574;   135
15570431000160; Banrisul FII Novas Fronteiras;0;BANRISUL NOVAS FRONTEIRAS FUNDO DE INVESTIMENTO IMOBILIARIO - FII;36113876;36113876;Artigo 8º, Inciso IV, 'b';ART8IVB; 0;F.I.I.;BANRISUL NOVAS FRONTEIRAS FUNDO DE INVESTIMENTO IMOBILIARIO - FII;2012-09-11;2012-05-09;NA;EM FUNCIONAMENTO NORMAL;2012-09-11;2020-01-01;2020-12-31;  34;0;NA;NA;NA
15576907000170; CEF FUNDO IMOBILIÁRIO AGÊNCIAS CAIXA FII;0;FUNDO DE INVESTIMENTO IMOBILIÁRIO RIO BRAVO RENDA VAREJO - FII;72600026;03864607;Artigo 8º, Inciso IV, 'b';ART8IVB; 0;F.I.I.;FUNDO DE INVESTIMENTO IMOBILIÁRIO RIO BRAVO RENDA VAREJO - FII;2012-11-01;2012-05-17;NA;EM FUNCIONAMENTO NORMAL;2012-11-01;2020-01-01;2020-12-31;  19;0;NA;NA;NA
15578417000103; OCCAM INSTITUCIONAL MULTIMERCADO II;0;OCCAM INSTITUCIONAL FUNDO DE INVESTIMENTO EM COTAS DE FUNDOS DE INVESTIMENTO MULTIMERCADO II;02201501;27916161;Artigo 8º, Inciso III;ART8III; 0;NA;NA;NA;NA;NA;NA;NA;NA;NA;   5;0;2020-05-29; 1188998287; 27242
15603945000175; VINCI SELECTION EQUITIES FUNDO DE INVESTIMENTO EM AÇÕES;0;VINCI SELECTION EQUITIES FUNDO DE INVESTIMENTO EM AÇÕES;00066670;13421810;Artigo 8º, Inciso II, 'a';ART8IIA; 1;NA;NA;NA;NA;NA;NA;NA;NA;NA;   8;0;2020-05-29;  386565783;   137
15711367000190; W7 MULTIESTRATÉGIA FIP;1;W7 FUNDO DE INVESTIMENTO EM PARTICIPAÇÕES;00806535;07152171;Artigo 8º, Inciso IV, 'a';ART8IVA; 0;FIP;W7 FUNDO DE INVESTIMENTO EM PARTICIPAÇÕES;2012-07-03;2012-07-18;NA;EM FUNCIONAMENTO NORMAL;2012-08-21;2020-03-01;2021-02-28;  28;0;NA;NA;NA
15769621000101; GENUS INSTITUCIONAL VALUE FI AÇÕES;1;ROMA INSTITUCIONAL VALUE FUNDO DE INVESTIMENTO EM AÇÕES;11010779;11010779;Artigo 8º, Inciso II, 'a';ART8IIA; 0;NA;NA;NA;NA;NA;NA;NA;NA;NA;  10;1;NA;NA;NA
15769670000144; RIO BRAVO CRÉDITO IMOBILIÁRIO II FUNDO DE INVESTIMENTO IMOBILIÁRIO - FII;0;RIO BRAVO CRÉDITO IMOBILIÁRIO II FUNDO DE INVESTIMENTO IMOBILIÁRIO - FII;72600026;03864607;Artigo 8º, Inciso IV, 'b';ART8IVB; 0;F.I.I.;RIO BRAVO CRÉDITO IMOBILIÁRIO II FUNDO DE INVESTIMENTO IMOBILIÁRIO - FII;2012-12-20;2012-06-19;NA;EM FUNCIONAMENTO NORMAL;2012-12-20;2020-01-01;2020-12-31;   1;0;NA;NA;NA
15775748000133; BB PREVIDENCIÁRIO RENDA FIXA IDKA 20 TITULOS PÚBLICOS FUNDO DE INVESTIMENTO;0;BB PREVIDENCIÁRIO RENDA FIXA IDKA 20 TÍTULOS PÚBLICOS FUNDO DE INVESTIMENTO;30822936;30822936;Artigo 7º, Inciso I, 'b';ART7IB; 1;NA;NA;NA;NA;NA;NA;NA;NA;NA;  22;0;NA;NA;NA
15798354000109; LSH MULTIESTRATÉGIA FIP;1;FUNDO DE INVESTIMENTO EM PARTICIPAÇÕES LSH - MULTIESTRATÉGIA;42066258;42066258;Artigo 8º, Inciso IV, 'a';ART8IVA; 0;FIP;FUNDO DE INVESTIMENTO EM PARTICIPAÇÕES LSH - MULTIESTRATÉGIA;2012-07-18;2012-08-02;NA;EM FUNCIONAMENTO NORMAL;2013-03-28;2020-03-01;2021-02-28;   8;1;NA;NA;NA
16437148000128; FIC FIP KINEA PRIVATE EQUITY II;0;FUNDO DE INVESTIMENTO EM COTAS DE FUNDOS DE INVESTIMENTO EM PARTICIPAÇÕES KINEA PRIVATE EQUITY II;15675095;04661817;Artigo 8º, Inciso IV, 'a';ART8IVA; 0;FIP;FUNDO DE INVESTIMENTO EM COTAS DE FUNDOS DE INVESTIMENTO EM PARTICIPAÇÕES KINEA PRIVATE EQUITY II;2012-07-23;2012-07-31;NA;EM FUNCIONAMENTO NORMAL;2012-08-29;2020-03-01;2021-02-28;   6;0;NA;NA;NA
16478738000107; ÁTICO II IMA-B FI RENDA FIXA;1;ELLEVEN FUNDO DE INVESTIMENTO RENDA FIXA II IMA-B 5;42066258;22119959;Artigo 7º, Inciso IV, 'a';ART7IVA; 0;NA;NA;NA;NA;NA;NA;NA;NA;NA;   3;0;NA;NA;NA
16501705000122; FLIT LONG STOCKS FI AÇÕES;0;FLIT FUNDO DE INVESTIMENTO EM AÇÕES LONG STOCKS;27652684;09630188;Artigo 8º, Inciso II, 'a';ART8IIA; 0;NA;NA;NA;NA;NA;NA;NA;NA;NA;   1;0;NA;NA;NA
16543270000189; FII SÃO DOMINGOS;1;SÃO DOMINGOS - FUNDO DE INVESTIMENTO IMOBILIÁRIO - FII;42066258;00329598;Artigo 8º, Inciso IV, 'b';ART8IVB; 0;F.I.I.;SÃO DOMINGOS - FUNDO DE INVESTIMENTO IMOBILIÁRIO - FII;2014-04-09;2012-07-11;NA;EM FUNCIONAMENTO NORMAL;2014-04-09;2020-01-01;2020-12-31;  12;0;NA;NA;NA
16565056000123; SPX APACHE FIQ FIA;0;SPX APACHE FUNDO DE INVESTIMENTO EM COTAS DE FUNDOS DE INVESTIMENTO DE AÇÕES;62418140;14595392;Artigo 8º, Inciso II, 'a';ART8IIA; 1;NA;NA;NA;NA;NA;NA;NA;NA;NA;   2;0;2020-05-29;  249548526;    72
16575255000112; XP DIVIDENDOS FUNDO DE INVESTIMENTO DE AÇÕES;0;XP DIVIDENDOS FUNDO DE INVESTIMENTO DE AÇÕES;62418140;07625200;Artigo 8º, Inciso II, 'a';ART8IIA; 1;NA;NA;NA;NA;NA;NA;NA;NA;NA;  13;0;2020-05-29;  262008558;  3421
16599968000116; AZ QUEST YIELD FIC RENDA FIXA LP;0;AZ QUEST YIELD FUNDO DE INVESTIMENTO EM COTAS DE FUNDOS DE INVESTIMENTO RENDA FIXA LONGO PRAZO;00066670;04506394;Artigo 7º, Inciso IV, 'a';ART7IVA; 1;NA;NA;NA;NA;NA;NA;NA;NA;NA;  13;0;2020-05-29;  260010932;  4568
16617446000108; Safra Small Cap PB Fic Ações;0;SAFRA SMALL CAP PB FUNDO DE INVESTIMENTO EM COTAS DE FUNDOS DE INVESTIMENTO EM AÇÕES;06947853;03017677;Artigo 8º, Inciso II, 'a';ART8IIA; 1;NA;NA;NA;NA;NA;NA;NA;NA;NA;   6;0;2020-05-29;  103052693;   375
16617536000190; FUNDO DE INVESTIMENTO EM PARTICIPAÇÕES MULTIESTRATÉGIA PUMA;1;FUNDO DE INVESTIMENTO EM PARTICIPAÇÕES MULTIESTRATÉGIA PUMA;92904564;15403817;Artigo 8º, Inciso IV, 'a';ART8IVA; 0;FIP;FUNDO DE INVESTIMENTO EM PARTICIPAÇÕES MULTIESTRATÉGIA PUMA;2012-10-05;2012-10-17;NA;EM FUNCIONAMENTO NORMAL;2013-01-18;2020-01-01;2020-12-31;   7;0;NA;NA;NA
16676620000185; CAIXA CYRELA FIP;0;FUNDO DE INVESTIMENTO EM PARTICIPACOES MULTIESTRATÉGIA CAIXA CYRELA;00360305;00360305;Artigo 8º, Inciso IV, 'a';ART8IVA; 1;FIP;FUNDO DE INVESTIMENTO EM PARTICIPACOES MULTIESTRATÉGIA CAIXA CYRELA;2012-10-09;2012-10-19;NA;EM FUNCIONAMENTO NORMAL;2013-10-02;2020-04-01;2021-03-31;  13;0;NA;NA;NA
16685929000131; LA SHOPPING CENTERS FIP;1;FUNDO DE INVEST.PARTICIPAÇÕES MULTIESTRATÉGIA LA SHOPPING CENTERS;62232889;20445967;Artigo 8º, Inciso IV, 'a';ART8IVA; 1;FIP;FUNDO DE INVEST.PARTICIPAÇÕES MULTIESTRATÉGIA LA SHOPPING CENTERS;2012-08-14;2012-08-28;NA;EM FUNCIONAMENTO NORMAL;2012-09-27;2020-01-01;2020-12-31;  13;0;NA;NA;NA
16703203000184; Western Asset Prev Alpha IBX FIC Ações;0;WESTERN ASSET PREV IBRX ALPHA AÇÕES FUNDO DE INVESTIMENTO EM COTAS DE FUNDOS DE INVESTIMENTO;01522368;07437241;Artigo 8º, Inciso I, 'a';ART8IA; 1;NA;NA;NA;NA;NA;NA;NA;NA;NA;   2;0;2020-05-29;  132117094;     8
16718302000130; ITAÚ MOMENTO 30 FIC AÇÕES;0;ITAÚ AÇÕES MOMENTO 30 FUNDO DE INVESTIMENTO EM COTAS DE FUNDOS DE INVESTIMENTO;60701190;60701190;Artigo 8º, Inciso II, 'a';ART8IIA; 1;NA;NA;NA;NA;NA;NA;NA;NA;NA;  35;0;2020-05-29; 1359288646; 31229
16720629000146; BRB QAM FIP PARANÁ I;1;FUNDO DE INVESTIMENTO EM PARTICIPAÇÃO IMOBILIÁRIO MULTIESTRATÉGIA PARANÁ REC;92904564;15403817;Artigo 8º, Inciso IV, 'a';ART8IVA; 0;FIP;FUNDO DE INVESTIMENTO EM PARTICIPAÇÃO IMOBILIÁRIO MULTIESTRATÉGIA PARANÁ REC;2012-10-19;2012-10-19;NA;EM FUNCIONAMENTO NORMAL;2012-12-21;2020-01-01;2020-12-31;  11;0;NA;NA;NA
16802320000103; XP CORPORATE MACAE FUNDO DE INVESTIMENTO IMOBILIARIO FII;0;XP CORPORATE MACAÉ FUNDO DE INVESTIMENTO IMOBILIÁRIO - FII;72600026;07625200;Artigo 8º, Inciso IV, 'b';ART8IVB; 0;F.I.I.;XP CORPORATE MACAÉ FUNDO DE INVESTIMENTO IMOBILIÁRIO - FII;2013-03-06;2012-08-17;NA;EM FUNCIONAMENTO NORMAL;2013-03-06;2020-01-01;2020-12-31;   3;0;NA;NA;NA
16841067000199; FII Reit Riviera;1;SOCOPA FUNDO DE INVESTIMENTO IMOBILIÁRIO;62285390;62285390;Artigo 8º, Inciso IV, 'b';ART8IVB; 0;F.I.I.;SOCOPA FUNDO DE INVESTIMENTO IMOBILIÁRIO;2014-03-10;2012-08-28;NA;EM FUNCIONAMENTO NORMAL;2014-03-10;2020-01-01;2020-12-31;   3;0;NA;NA;NA
16844885000145; Banrisul Foco IRF-M;0;BANRISUL FOCO IRF-M FUNDO DE INVESTIMENTO RENDA FIXA LONGO PRAZO;92702067;93026847;Artigo 7º, Inciso I, 'b';ART7IB; 1;NA;NA;NA;NA;NA;NA;NA;NA;NA; 120;0;2020-05-29;  428451129;  1610
16844890000158; BANRISUL FOCO IMA-B FI RENDA FIXA LP;0;BANRISUL FOCO IMA-B FUNDO DE INVESTIMENTO RENDA FIXA REFERENCIADO LONGO PRAZO;92702067;93026847;Artigo 7º, Inciso III, 'a';ART7IIIA; 1;NA;NA;NA;NA;NA;NA;NA;NA;NA;  31;0;2020-05-29;  144551720;  1084
16915868000151; JHSF RIO BRAVO FAZENDA BOA VISTA CAPITAL PROTEGIDO FII;0;JHSF RIO BRAVO FAZENDA BOA VISTA CAPITAL PROTEGIDO FUNDO DE INVESTIMENTO IMOBILIARIO - FII;00360305;03864607;Artigo 8º, Inciso IV, 'b';ART8IVB; 1;F.I.I.;JHSF RIO BRAVO FAZENDA BOA VISTA CAPITAL PROTEGIDO FUNDO DE INVESTIMENTO IMOBILIARIO - FII;2013-07-22;2012-09-18;NA;EM FUNCIONAMENTO NORMAL;2013-07-22;2020-01-01;2020-12-31;   5;0;NA;NA;NA
16915968000188; MÉRITO DESENVOLVIMENTO IMOBILIÁRIO I FII;1;MERITO DESENVOLVIMENTO IMOBILIARIO I FII - FUNDO DE INVESTIMENTO IMOBILIARIO;00806535;15632652;Artigo 8º, Inciso IV, 'b';ART8IVB; 0;F.I.I.;MERITO DESENVOLVIMENTO IMOBILIARIO I FII - FUNDO DE INVESTIMENTO IMOBILIARIO;2013-03-06;2012-09-06;NA;EM FUNCIONAMENTO NORMAL;2013-03-06;2020-01-01;2020-12-31;   8;0;NA;NA;NA
17013985000192; GBX PRIME I FIDC;1;GGR PRIME I FUNDO DE INVESTIMENTO EM DIREITOS CREDITÓRIOS;02671743;11333851;Artigo 7º, Inciso VII, 'a';ART7VIIA; 0;FIDC;GGR PRIME I FUNDO DE INVESTIMENTO EM DIREITOS CREDITÓRIOS;2012-12-19;2012-12-28;NA;LIQUIDAÇÃO;2019-02-25;2020-01-01;2020-12-31;  38;0;NA;NA;NA
17021319000104; MÉRITO MULTIMERCADO I FIC FI;1;TG SAFIRA FUNDO DE INVESTIMENTO EM COTAS DE FUNDOS DE INVESTIMENTO MULTIMERCADO;13486793;13194316;Artigo 8º, Inciso III;ART8III; 0;NA;NA;NA;NA;NA;NA;NA;NA;NA;  11;0;2020-05-29;   42947297;   446
17073556000100; KINEA PIPE FI AÇÕES;0;KINEA PIPE FUNDO DE INVESTIMENTO EM AÇÕES;62418140;08604187;Artigo 8º, Inciso II, 'a';ART8IIA; 1;NA;NA;NA;NA;NA;NA;NA;NA;NA;   8;0;NA;NA;NA
17098794000170; CAIXA RIO BRAVO FUNDO DE FUNDOS FII - CXRI11;0;CAIXA RIO BRAVO FUNDO DE FUNDOS DE INVESTIMENTO IMOBILIARIO - FII;00360305;00360305;Artigo 8º, Inciso IV, 'b';ART8IVB; 1;F.I.I.;CAIXA RIO BRAVO FUNDO DE FUNDOS DE INVESTIMENTO IMOBILIARIO - FII;2013-11-22;2012-10-24;NA;EM FUNCIONAMENTO NORMAL;2013-11-22;2020-01-01;2020-12-31;  92;0;NA;NA;NA
17116227000108; BB Pipe Fic Ações;0;BB AÇÕES PIPE FUNDO DE INVESTIMENTO EM COTAS DE FUNDOS DE INVESTIMENTO;30822936;30822936;Artigo 8º, Inciso II, 'a';ART8IIA; 1;NA;NA;NA;NA;NA;NA;NA;NA;NA;  41;0;NA;NA;NA
17136970000111; VINCI FI RF IMOBILIÁRIO - CRÉDITO PRIVADO;0;VINCI FUNDO DE INVESTIMENTO RENDA FIXA IMOBILIÁRIO - CRÉDITO PRIVADO;00066670;11077576;Artigo 7º, Inciso VII, 'b';ART7VIIB; 1;NA;NA;NA;NA;NA;NA;NA;NA;NA;   1;0;2020-05-29;  364744048;    19
17138474000105; SANTANDER MASTER FI RENDA FIXA CREDITO PRIVADO LP;0;NA;NA;NA;NA;NA;NA;NA;NA;NA;NA;NA;NA;NA;NA;NA;   2;0;2020-05-29; 2206809292;   135
17213759000155; FONTAINE VILLE URBANISMO MULTIESTRATÉGIA FIP;1;FUNDO DE INVESTIMENTO EM PARTICIPAÇÕES FONTAINE VILLE URBANISMO MULTIESTRATÉGIA;19182613;19182613;Artigo 8º, Inciso IV, 'a';ART8IVA; 0;FIP;FUNDO DE INVESTIMENTO EM PARTICIPAÇÕES FONTAINE VILLE URBANISMO MULTIESTRATÉGIA;2013-05-20;2013-05-27;NA;EM FUNCIONAMENTO NORMAL;2014-05-21;2020-05-01;2021-04-30;   4;0;NA;NA;NA
17213821000109; CAIS MAUÁ DO BRASIL FIP;1;FUNDO DE INVESTIMENTO EM PARTICIPACOES CAIS MAUA DO BRASIL INFRAESTRUTURA;28376231;28376231;Artigo 8º, Inciso IV, 'a';ART8IVA; 0;FIP;FUNDO DE INVESTIMENTO EM PARTICIPACOES CAIS MAUA DO BRASIL INFRAESTRUTURA;2012-11-29;2012-12-04;NA;EM FUNCIONAMENTO NORMAL;2013-01-21;2020-01-01;2020-12-31;  10;0;NA;NA;NA
17213849000146; SICÍLIA FI RENDA FIXA LP;1;FUNDO DE INVESTIMENTO SICÍLIA RENDA FIXA LONGO PRAZO;42066258;12678380;Artigo 7º, Inciso IV, 'a';ART7IVA; 0;NA;NA;NA;NA;NA;NA;NA;NA;NA;   4;0;NA;NA;NA
17253869000140; Safra Premium Multimercado;0;SAFRA CARTEIRA PREMIUM FUNDO DE INVESTIMENTO MULTIMERCADO;06947853;62180047;Artigo 8º, Inciso III;ART8III; 0;NA;NA;NA;NA;NA;NA;NA;NA;NA;  17;0;2020-05-29; 1260363348;  1113
17302306000103; BRB FI RENDA FIXA 2023;0;BRB FUNDO DE INVESTIMENTO EM RENDA FIXA 2023;33850686;33850686;Artigo 7º, Inciso I, 'b';ART7IB; 1;NA;NA;NA;NA;NA;NA;NA;NA;NA;   5;0;2020-05-29;   72569636;     5
17311079000174; FII SIA CORPORATE;0;FUNDO DE INVESTIMENTO IMOBILIARIO - FII SIA CORPORATE;33850686;33850686;Artigo 8º, Inciso IV, 'b';ART8IVB; 1;F.I.I.;FUNDO DE INVESTIMENTO IMOBILIARIO - FII SIA CORPORATE;2014-03-12;2012-11-07;NA;EM FUNCIONAMENTO NORMAL;2014-03-12;2020-01-01;2020-12-31;   7;0;NA;NA;NA
17324357000128; BRASIL PLURAL ABSOLUTO FUNDO FE FUNDOS FII - BPFF11;0;FUNDO DE INVESTIMENTO IMOBILIÁRIO - FII BRASIL PLURAL ABSOLUTO FUNDO DE FUNDOS;27652684;11397672;Artigo 8º, Inciso IV, 'b';ART8IVB; 0;F.I.I.;FUNDO DE INVESTIMENTO IMOBILIÁRIO - FII BRASIL PLURAL ABSOLUTO FUNDO DE FUNDOS;2013-04-09;2012-12-11;NA;EM FUNCIONAMENTO NORMAL;2013-04-09;2020-01-01;2020-12-31;   2;0;NA;NA;NA
17335646000122; Indie Fundo de Investimento em Cotas de Fundos de Investimento de Ações;0;NA;NA;NA;NA;NA;NA;NA;NA;NA;NA;NA;NA;NA;NA;NA;   3;0;2020-05-29;  760668702; 18705
17365105000147; BTG Pactual FII TB Office;0;FUNDO DE INVESTIMENTO IMOBILIÁRIO - FII TB OFFICE;59281253;59281253;Artigo 8º, Inciso IV, 'b';ART8IVB; 1;F.I.I.;FUNDO DE INVESTIMENTO IMOBILIÁRIO - FII TB OFFICE;2013-06-07;2012-12-28;NA;EM FUNCIONAMENTO NORMAL;2013-06-07;2020-01-01;2020-12-31;   2;0;NA;NA;NA
17374696000119; REAG RENDA IMOBILIÁRIA FII - DOMC11;0;REAG RENDA IMOBILIÁRIA - FUNDO DE INVESTIMENTO IMOBILIÁRIO - FII;12063256;18606232;Artigo 8º, Inciso IV, 'b';ART8IVB; 0;F.I.I.;REAG RENDA IMOBILIÁRIA - FUNDO DE INVESTIMENTO IMOBILIÁRIO - FII;2013-12-13;2013-01-04;NA;EM FUNCIONAMENTO NORMAL;2013-12-13;2020-01-01;2020-12-31;  15;0;NA;NA;NA
17412812000147; OSLO FI MULTIMERCADO;1;FUNDO DE INVESTIMENTO MULTIMERCADO OSLO;11010779;11010779;Artigo 8º, Inciso III;ART8III; 0;NA;NA;NA;NA;NA;NA;NA;NA;NA;   6;0;NA;NA;NA
17413636000168; BB MULTIMERCADO GLOBAL SELECT EQUITY INVESTIMENTO NO EXTERIOR FUNDO DE INVESTIMENTO;0;BB MULTIMERCADO GLOBAL SELECT EQUITY INVESTIMENTO NO EXTERIOR FUNDO DE INVESTIMENTO;30822936;30822936;Artigo 9-Aº, Inciso II;ART9AII; 1;NA;NA;NA;NA;NA;NA;NA;NA;NA;   2;0;2020-05-29;  809282199;    50
17433039000103; CEF FI BTG PACTUAL X 10 MULT LP;0;NA;NA;NA;NA;NA;NA;NA;NA;NA;NA;NA;NA;NA;NA;NA;   2;0;2020-05-29; 1528967532;  6490
17453850000148; WESTERN ASSET US INDEX 500 FI MULTIMERCADO;0;WESTERN ASSET US INDEX 500 FUNDO DE INVESTIMENTO MULTIMERCADO;01522368;07437241;Artigo 8º, Inciso III;ART8III; 1;NA;NA;NA;NA;NA;NA;NA;NA;NA;  24;0;2020-05-29;  867265876;  8960
17502937000168; CAIXA INSTITUCIONAL BDR NÍVEL I FI AÇÕES;0;FUNDO DE INVESTIMENTO EM AÇÕES CAIXA INSTITUCIONAL BDR NÍVEL I;00360305;00360305;Artigo 9ºA, Inciso III;ART9AIII; 1;NA;NA;NA;NA;NA;NA;NA;NA;NA; 117;0;2020-05-29; 1133955742;    98
17503172000180; CAIXA FI AÇÕES BDR NIVEL I;0;FUNDO DE INVESTIMENTO EM AÇÕES CAIXA BDR NÍVEL I;00360305;00360305;Artigo 9ºA, Inciso III;ART9AIII; 1;NA;NA;NA;NA;NA;NA;NA;NA;NA;   8;0;2020-05-29;  317614290;  4464
17517577000178; WESTERN ASSET IMA-B 5 ATIVO FI RF;0;WESTERN ASSET IMAB5 ATIVO FUNDO DE INVESTIMENTO RENDA FIXA;01522368;07437241;Artigo 7º, Inciso I, 'b';ART7IB; 1;NA;NA;NA;NA;NA;NA;NA;NA;NA;  19;0;2020-05-29;  568107044;   355
17517779000110; CATÂNIA FI RENDA FIXA LP;1;FUNDO DE INVESTIMENTO CATÂNIA RENDA FIXA LONGO PRAZO;42066258;14717397;Artigo 7º, Inciso IV, 'a';ART7IVA; 0;NA;NA;NA;NA;NA;NA;NA;NA;NA;   8;0;NA;NA;NA
17593934000187; BB AÇÕES BB SEGURIDADE FI AÇÕES;0;BB AÇÕES BB SEGURIDADE FUNDO DE INVESTIMENTO EM AÇÕES;30822936;30822936;Artigo 8º, Inciso II, 'a';ART8IIA; 1;NA;NA;NA;NA;NA;NA;NA;NA;NA;   5;0;2020-05-29;   89050974;  6870
17709881000117; XP OMEGA FIP;0;FUNDO DE INVESTIMENTO EM PARTICIPAÇÕES EM INFRAESTRUTURA XP OMEGA I;22610500;07625200;Artigo 8º, Inciso IV, 'a';ART8IVA; 0;FIP;FUNDO DE INVESTIMENTO EM PARTICIPAÇÕES EM INFRAESTRUTURA XP OMEGA I;2013-04-26;2013-04-30;NA;EM FUNCIONAMENTO NORMAL;2013-06-19;2020-03-01;2021-02-28;   1;0;NA;NA;NA
17804792000150; SANTANDER FI GLOBAL EQUITIES MULTIMERCADO INVESTIMENTO NO EXTERIOR;0;SANTANDER FI GLOBAL EQUITIES MULTIMERCADO INVESTIMENTO NO EXTERIOR;90400888;10231177;Artigo 9-Aº, Inciso II;ART9AII; 1;NA;NA;NA;NA;NA;NA;NA;NA;NA;   2;0;2020-05-29;  269855977;   150
17870798000125; P2 BRASIL INFRAESTRUTURA III FIQ FIP;0;PATRIA BRASIL INFRAESTRUTURA III FIC DE FUNDO DE INVESTIMENTO EM PARTICIPAçõES;10413618;10413618;Artigo 8º, Inciso IV, 'a';ART8IVA; 0;FIP;Patria Brasil Infraestrutura III FIC de Fundo de Investimento em Participações;2013-03-14;2013-03-14;NA;EM FUNCIONAMENTO NORMAL;2014-06-25;2020-01-01;2020-12-31;   2;0;NA;NA;NA
18007710000109; FIC FI CAIXA MM MULTIGESTOR;0;FUNDO DE INVESTIMENTO EM COTAS DE FUNDOS DE INVESTIMENTO CAIXA MULTIMERCADO MULTIGESTOR;00360305;00360305;Artigo 8º, Inciso III;ART8III; 1;NA;NA;NA;NA;NA;NA;NA;NA;NA;   4;0;2020-05-29;  483386063;  3715
18048639000102; MAUA INSTITUCIONAL FIC MULTIMERCADO;0;MAUÁ INSTITUCIONAL FUNDO DE INVESTIMENTO EM COTAS DE FUNDOS DE INVESTIMENTO MULTIMERCADO;59281253;07170960;Artigo 8º, Inciso III;ART8III; 1;NA;NA;NA;NA;NA;NA;NA;NA;NA;   4;0;2020-05-29;  244892284;  3539
18079540000178; BRADESCO S&P 500 MAIS FI MULTIMERCADO;0;BRADESCO FUNDO DE INVESTIMENTO MULTIMERCADO S&P 500 MAIS;60746948;62375134;Artigo 8º, Inciso III;ART8III; 1;NA;NA;NA;NA;NA;NA;NA;NA;NA;   7;0;2020-05-29;  108404293;   960
18098502000162; BNB BTG PACTUAL DIVIDENDOS FIC AÇÕES;0;BNB ALOCAÇÃO FUNDO DE INVESTIMENTO AÇÕES;62318407;07237373;Artigo 8º, Inciso II, 'a';ART8IIA; 1;NA;NA;NA;NA;NA;NA;NA;NA;NA;   5;0;NA;NA;NA
18270783000199; BB PREVID AÇÕES ALOCAÇÕES FIC DE FI;0;BB AÇÕES ALOCAÇÃO FUNDO DE INVESTIMENTO EM AÇÕES;30822936;30822936;Artigo 8º, Inciso II, 'a';ART8IIA; 1;NA;NA;NA;NA;NA;NA;NA;NA;NA; 106;0;2020-05-29;  335619018;   479
18289873000121; BB VOTORANTIN HIGHLAND INFRA ESTRUTURA FIDC SENIOR;0;FUNDO DE INVESTIMENTO EM DIREITOS CREDITÓRIOS BB VOTORANTIM HIGHLAND INFRAESTRUTURA;30822936;03384738;Artigo 7º, Inciso VII, 'a';ART7VIIA; 1;FIDC;FUNDO DE INVESTIMENTO EM DIREITOS CREDITÓRIOS BB VOTORANTIM HIGHLAND INFRAESTRUTURA;2013-11-19;2013-12-03;NA;EM FUNCIONAMENTO NORMAL;2013-12-30;2020-01-01;2020-12-31;   2;0;NA;NA;NA
18307582000119; HEDGE TOP FOFII 3 FUNDO DE INVESTIMENTO IMOBILIÁRIO;0;NA;NA;NA;NA;NA;NA;F.I.I.;HEDGE TOP FOFII 3 FUNDO DE INVESTIMENTO IMOBILIÁRIO;2017-10-19;2013-07-08;NA;EM FUNCIONAMENTO NORMAL;2018-02-27;2020-01-01;2020-12-31;   1;0;NA;NA;NA
18366002000164; BRS PARTICIPAÇÕES FIC MULTIMERCADO CRÉDITO PRIVADO;1;AUSTRO MULTIPAR FUNDO DE INVESTIMENTO EM COTA DE FUNDOS DE INVESTIMENTO MULTIMERCADO CRÉDITO PRIVADO;14717397;09442277;Artigo 8º, Inciso III;ART8III; 0;NA;NA;NA;NA;NA;NA;NA;NA;NA;  31;0;NA;NA;NA
18369510000104; FUNDO DE INVESTIMENTO IMOBILIÁRIO INFRA REAL ESTATE - FII;1;FUNDO DE INVESTIMENTO IMOBILIÁRIO INFRA REAL ESTATE - FII;00806535;05599583;Artigo 8º, Inciso IV, 'b';ART8IVB; 0;F.I.I.;FUNDO DE INVESTIMENTO IMOBILIÁRIO INFRA REAL ESTATE - FII;2013-10-04;2013-06-17;NA;EM FUNCIONAMENTO NORMAL;2013-10-04;2019-07-01;2020-06-30;   3;0;NA;NA;NA
18373362000193; ATICO GESTAO EMPRESARIAL - FUNDO DE INVESTIMENTO EM PARTICIPACOES;1;FIP GESTÃO EMPRESARIAL - FUNDO DE INVESTIMENTO EM PARTICIPAÇOES MULTIESTRATÉGIA;42066258;01290707;Artigo 8º, Inciso IV, 'a';ART8IVA; 0;FIP;FIP GESTÃO EMPRESARIAL - FUNDO DE INVESTIMENTO EM PARTICIPAÇOES MULTIESTRATÉGIA;2013-08-01;2013-06-19;NA;EM FUNCIONAMENTO NORMAL;2014-04-03;2020-03-01;2021-02-28;   5;1;NA;NA;NA
18466245000174; BANRISUL FOCO IRF-M 1 FI RENDA FIXA;0;BANRISUL FOCO IRF-M 1 FUNDO DE INVESTIMENTO RENDA FIXA;92702067;93026847;Artigo 7º, Inciso I, 'b';ART7IB; 1;NA;NA;NA;NA;NA;NA;NA;NA;NA; 259;0;2020-05-29; 1682397922;   338
18598042000131; CAIXA BRASIL 2030 I TÍTULOS PÚBLICOS FI RENDA FIXA;0;FUNDO DE INVESTIMENTO CAIXA BRASIL 2030 I TÍTULOS PÚBLICOS RENDA FIXA;00360305;00360305;Artigo 7º, Inciso I, 'b';ART7IB; 1;NA;NA;NA;NA;NA;NA;NA;NA;NA;  34;0;2020-05-29;  216835484;    34
18598088000150; FI CAIXA BRASIL 2024 II TÍTULOS PÚBLICOS RF;0;FUNDO DE INVESTIMENTO CAIXA BRASIL 2024 II TÍTULOS PÚBLICOS RENDA FIXA;00360305;00360305;Artigo 7º, Inciso I, 'b';ART7IB; 1;NA;NA;NA;NA;NA;NA;NA;NA;NA;  38;0;2020-05-29;  191363087;    38
18598117000184; FI CAIXA BRASIL 2022 I TITULOS PUBLICOS RF;0;FUNDO DE INVESTIMENTO CAIXA BRASIL 2022 I TÍTULOS PÚBLICOS RENDA FIXA;00360305;00360305;Artigo 7º, Inciso I, 'b';ART7IB; 1;NA;NA;NA;NA;NA;NA;NA;NA;NA;  17;0;2020-05-29;   82579505;    17
18598154000192; FI CAIXA BRASIL 2020 I TP RF;0;FUNDO DE INVESTIMENTO CAIXA BRASIL 2020 I TÍTULOS PÚBLICOS RENDA FIXA;00360305;00360305;Artigo 7º, Inciso I, 'b';ART7IB; 1;NA;NA;NA;NA;NA;NA;NA;NA;NA;  19;0;2020-05-29;  140874263;    19
18598256000108; CAIXA FI BRASIL 2018 I TP RF;0;NA;NA;NA;NA;NA;NA;NA;NA;NA;NA;NA;NA;NA;NA;NA; 161;0;NA;NA;NA
18598288000103; CAIXA BRASIL 2024 I TÍTULOS PÚBLICOS FI RENDA FIXA;0;FUNDO DE INVESTIMENTO CAIXA BRASIL 2024 I TÍTULOS PÚBLICOS RENDA FIXA;00360305;00360305;Artigo 7º, Inciso I, 'b';ART7IB; 1;NA;NA;NA;NA;NA;NA;NA;NA;NA; 103;0;2020-05-29;  454184206;   104
18599673000175; SANATANDER IMA-B 5 TOP FI RENDA FIXA LP;0;SANTANDER FI IMA-B 5 TOP RENDA FIXA LONGO PRAZO;90400888;10231177;Artigo 7º, Inciso I, 'b';ART7IB; 1;NA;NA;NA;NA;NA;NA;NA;NA;NA;   1;0;2020-05-29;  120662417;   118
18602064000128; FL PREMIUM INSTITUCIONAL FUNDO DE INVESTIMENTO RENDA FIXA LONGO PRAZO;0;FL PREMIUM INSTITUCIONAL FUNDO DE INVESTIMENTO RENDA FIXA LONGO PRAZO;42066258;10995802;Artigo 7º, Inciso IV, 'a';ART7IVA; 0;NA;NA;NA;NA;NA;NA;NA;NA;NA;   3;0;NA;NA;NA
18719154000101; Porto Seguro FI Ref. DI Crédito Privado;0;NA;NA;NA;NA;NA;NA;NA;NA;NA;NA;NA;NA;NA;NA;NA;   1;0;2020-05-29;  953716805;  9180
18800239000101; BRASIL AGRO II FIP;0;FIP BRASIL AGRO II MULTIESTRATÉGIA;03384738;03384738;Artigo 8º, Inciso IV, 'a';ART8IVA; 1;FIP;FIP BRASIL AGRO II MULTIESTRATÉGIA;2013-09-05;2013-09-12;NA;EM FUNCIONAMENTO NORMAL;2015-07-08;2020-01-01;2020-12-31;   1;0;NA;NA;NA
